problem_id,title,company,frequency,difficulty,topics,acceptance_rate,premium,category,likes,dislikes,url,freq_score,difficulty_num,relevance_score
2260,Minimum Consecutive Cards to Pick Up,Google,1.0,Medium,"Array, Hash Table, Sliding Window",52.88,False,Algorithms,1062,44,https://leetcode.com/problems/minimum-consecutive-cards-to-pick-up,0.0133,2,0.208
2259,Remove Digit From Number to Maximize Result,Microsoft,2.0,Easy,"String, Greedy, Enumeration",47.61,False,Algorithms,918,64,https://leetcode.com/problems/remove-digit-from-number-to-maximize-result,0.0385,1,0.4231
2256,Minimum Average Difference,Amazon,1.0,Medium,"Array, Prefix Sum",43.6,False,Algorithms,1552,180,https://leetcode.com/problems/minimum-average-difference,0.0,2,0.2
2255,Count Prefixes of a Given String,Google,1.0,Easy,"Array, String",74.0,False,Algorithms,589,24,https://leetcode.com/problems/count-prefixes-of-a-given-string,0.0133,1,0.408
2248,Intersection of Multiple Arrays,Uber,1.0,Easy,"Array, Hash Table, Sorting, Counting",68.51,False,Algorithms,783,43,https://leetcode.com/problems/intersection-of-multiple-arrays,0.0,1,0.4
2244,Minimum Rounds to Complete All Tasks,Amazon,1.0,Medium,"Array, Hash Table, Greedy, Counting",63.01,False,Algorithms,2823,83,https://leetcode.com/problems/minimum-rounds-to-complete-all-tasks,0.0,2,0.2
2243,Calculate Digit Sum of a String,Uber,1.0,Easy,"String, Simulation",66.75,False,Algorithms,574,51,https://leetcode.com/problems/calculate-digit-sum-of-a-string,0.0,1,0.4
2239,Find Closest Number to Zero,Tiger Analytics,1.0,Easy,Array,47.35,False,Algorithms,757,51,https://leetcode.com/problems/find-closest-number-to-zero,0.0,1,0.4
2220,Minimum Bit Flips to Convert Number,Persistent Systems,1.0,Easy,Bit Manipulation,87.65,False,Algorithms,1492,35,https://leetcode.com/problems/minimum-bit-flips-to-convert-number,0.0,1,0.4
2215,Find the Difference of Two Arrays,Google,1.0,Easy,"Array, Hash Table",80.99,False,Algorithms,2549,118,https://leetcode.com/problems/find-the-difference-of-two-arrays,0.0133,1,0.408
2210,Count Hills and Valleys in an Array,Facebook,1.0,Easy,Array,69.35,False,Algorithms,1120,138,https://leetcode.com/problems/count-hills-and-valleys-in-an-array,0.0,1,0.4
2208,Minimum Operations to Halve Array Sum,Microsoft,1.0,Medium,"Array, Greedy, Heap (Priority Queue)",49.18,False,Algorithms,663,30,https://leetcode.com/problems/minimum-operations-to-halve-array-sum,0.0192,2,0.2115
2206,Divide Array Into Equal Pairs,Microsoft,1.0,Easy,"Array, Hash Table, Bit Manipulation, Counting",79.28,False,Algorithms,1171,50,https://leetcode.com/problems/divide-array-into-equal-pairs,0.0192,1,0.4115
2201,Count Artifacts That Can Be Extracted,Imc,1.0,Medium,"Array, Hash Table, Simulation",56.49,False,Algorithms,222,204,https://leetcode.com/problems/count-artifacts-that-can-be-extracted,0.0,2,0.2
2200,Find All K-Distant Indices in an Array,Google,1.0,Easy,"Array, Two Pointers",77.44,False,Algorithms,782,128,https://leetcode.com/problems/find-all-k-distant-indices-in-an-array,0.0133,1,0.408
2190,Most Frequent Number Following Key In an Array,Google,1.0,Easy,"Array, Hash Table, Counting",59.27,False,Algorithms,397,249,https://leetcode.com/problems/most-frequent-number-following-key-in-an-array,0.0133,1,0.408
2186,Minimum Number of Steps to Make Two Strings Anagram II,Wealthfront,1.0,Medium,"Hash Table, String, Counting",72.9,False,Algorithms,598,27,https://leetcode.com/problems/minimum-number-of-steps-to-make-two-strings-anagram-ii,0.0,2,0.2
2185,Counting Words With a Given Prefix,Google,1.0,Easy,"Array, String, String Matching",84.51,False,Algorithms,1097,37,https://leetcode.com/problems/counting-words-with-a-given-prefix,0.0133,1,0.408
2182,Construct String With Repeat Limit,Arista Networks,1.0,Medium,"Hash Table, String, Greedy, Heap (Priority Queue), Counting",70.9,False,Algorithms,1224,98,https://leetcode.com/problems/construct-string-with-repeat-limit,0.0,2,0.2
2181,Merge Nodes in Between Zeros,Microsoft,1.0,Medium,"Linked List, Simulation",89.59,False,Algorithms,2441,50,https://leetcode.com/problems/merge-nodes-in-between-zeros,0.0192,2,0.2115
2180,Count Integers With Even Digit Sum,Mindtree,1.0,Easy,"Math, Simulation",69.06,False,Algorithms,685,38,https://leetcode.com/problems/count-integers-with-even-digit-sum,0.0,1,0.4
2177,Find Three Consecutive Integers That Sum to a Given Number,Fpt,1.0,Medium,"Math, Simulation",64.8,False,Algorithms,713,233,https://leetcode.com/problems/find-three-consecutive-integers-that-sum-to-a-given-number,0.0,2,0.2
2176,Count Equal and Divisible Pairs in an Array,Zeta Suite,1.0,Easy,Array,84.04,False,Algorithms,1012,64,https://leetcode.com/problems/count-equal-and-divisible-pairs-in-an-array,0.0,1,0.4
2169,Count Operations to Obtain Zero,Payu,1.0,Easy,"Math, Simulation",75.06,False,Algorithms,639,25,https://leetcode.com/problems/count-operations-to-obtain-zero,0.0,1,0.4
2166,Design Bitset,Bloomberg,2.0,Medium,"Array, Hash Table, String, Design",31.99,False,Algorithms,601,49,https://leetcode.com/problems/design-bitset,0.0159,2,0.2095
2165,Smallest Value of the Rearranged Number,Cognizant,0.0,Medium,"Math, Sorting",52.9,False,Algorithms,669,26,https://leetcode.com/problems/smallest-value-of-the-rearranged-number,0.0,2,0.2
2164,Sort Even and Odd Indices Independently,Zoho,1.0,Easy,"Array, Sorting",62.78,False,Algorithms,778,68,https://leetcode.com/problems/sort-even-and-odd-indices-independently,0.0,1,0.4
2161,Partition Array According to Given Pivot,Amazon,1.0,Medium,"Array, Two Pointers, Simulation",89.87,False,Algorithms,1702,118,https://leetcode.com/problems/partition-array-according-to-given-pivot,0.0,2,0.2
2160,Minimum Sum of Four Digit Number After Splitting Digits,Amazon,1.0,Easy,"Math, Greedy, Sorting",86.15,False,Algorithms,1481,147,https://leetcode.com/problems/minimum-sum-of-four-digit-number-after-splitting-digits,0.0,1,0.4
2155,All Divisions With the Highest Score of a Binary Array,Google,1.0,Medium,Array,64.61,False,Algorithms,522,17,https://leetcode.com/problems/all-divisions-with-the-highest-score-of-a-binary-array,0.0133,2,0.208
2154,Keep Multiplying Found Values by Two,Goldman Sachs,1.0,Easy,"Array, Hash Table, Sorting, Simulation",71.29,False,Algorithms,760,42,https://leetcode.com/problems/keep-multiplying-found-values-by-two,0.0263,1,0.4158
2150,Find All Lonely Numbers in the Array,Google,1.0,Medium,"Array, Hash Table, Counting",61.93,False,Algorithms,682,65,https://leetcode.com/problems/find-all-lonely-numbers-in-the-array,0.0133,2,0.208
2149,Rearrange Array Elements by Sign,Amazon,1.0,Medium,"Array, Two Pointers, Simulation",84.45,False,Algorithms,3823,215,https://leetcode.com/problems/rearrange-array-elements-by-sign,0.0,2,0.2
2139,Minimum Moves to Reach Target Score,Wayfair,1.0,Medium,"Math, Greedy",51.64,False,Algorithms,1042,26,https://leetcode.com/problems/minimum-moves-to-reach-target-score,0.0,2,0.2
2138,Divide a String Into Groups of Size k,Canonical,1.0,Easy,"String, Simulation",77.07,False,Algorithms,770,31,https://leetcode.com/problems/divide-a-string-into-groups-of-size-k,0.0,1,0.4
2134,Minimum Swaps to Group All 1's Together II,Amazon,2.0,Medium,"Array, Sliding Window",65.57,False,Algorithms,2052,41,https://leetcode.com/problems/minimum-swaps-to-group-all-1s-together-ii,0.0086,2,0.2052
2133,Check if Every Row and Column Contains All Numbers,Karat,4.0,Easy,"Array, Hash Table, Matrix",53.14,False,Algorithms,1044,55,https://leetcode.com/problems/check-if-every-row-and-column-contains-all-numbers,0.0526,1,0.4316
2133,Check if Every Row and Column Contains All Numbers,Instacart,2.0,Easy,"Array, Hash Table, Matrix",53.14,False,Algorithms,1044,55,https://leetcode.com/problems/check-if-every-row-and-column-contains-all-numbers,0.0,1,0.4
2130,Maximum Twin Sum of a Linked List,Amazon,23.0,Medium,"Linked List, Two Pointers, Stack",81.54,False,Algorithms,3784,120,https://leetcode.com/problems/maximum-twin-sum-of-a-linked-list,0.1897,2,0.3138
2126,Destroying Asteroids,Google,1.0,Medium,"Array, Greedy, Sorting",52.77,False,Algorithms,584,196,https://leetcode.com/problems/destroying-asteroids,0.0133,2,0.208
2125,Number of Laser Beams in a Bank,Amazon,6.0,Medium,"Array, Math, String, Matrix",85.41,False,Algorithms,1935,196,https://leetcode.com/problems/number-of-laser-beams-in-a-bank,0.0431,2,0.2259
2124,Check if All A's Appears Before All B's,Microsoft,1.0,Easy,String,72.46,False,Algorithms,804,20,https://leetcode.com/problems/check-if-all-as-appears-before-all-bs,0.0192,1,0.4115
2116,Check if a Parentheses String Can Be Valid,Amazon,2.0,Medium,"String, Stack, Greedy",44.91,False,Algorithms,1990,130,https://leetcode.com/problems/check-if-a-parentheses-string-can-be-valid,0.0086,2,0.2052
2114,Maximum Number of Words Found in Sentences,Google,1.0,Easy,"Array, String",86.6,False,Algorithms,1828,62,https://leetcode.com/problems/maximum-number-of-words-found-in-sentences,0.0133,1,0.408
2110,Number of Smooth Descent Periods of a Stock,Amazon,4.0,Medium,"Array, Math, Dynamic Programming",59.36,False,Algorithms,748,35,https://leetcode.com/problems/number-of-smooth-descent-periods-of-a-stock,0.0259,2,0.2155
2109,Adding Spaces to a String,Amazon,1.0,Medium,"Array, Two Pointers, String, Simulation",71.69,False,Algorithms,1085,113,https://leetcode.com/problems/adding-spaces-to-a-string,0.0,2,0.2
2103,Rings and Rods,Google,6.0,Easy,"Hash Table, String",81.26,False,Algorithms,1004,20,https://leetcode.com/problems/rings-and-rods,0.08,1,0.448
2099,Find Subsequence of Length K With the Largest Sum,Accenture,1.0,Easy,"Array, Hash Table, Sorting, Heap (Priority Queue)",57.5,False,Algorithms,1717,179,https://leetcode.com/problems/find-subsequence-of-length-k-with-the-largest-sum,0.0,1,0.4
2090,K Radius Subarray Averages,Facebook,3.0,Medium,"Array, Sliding Window",45.95,False,Algorithms,2020,100,https://leetcode.com/problems/k-radius-subarray-averages,0.0071,2,0.2043
2089,Find Target Indices After Sorting Array,Google,4.0,Easy,"Array, Binary Search, Sorting",77.42,False,Algorithms,1915,104,https://leetcode.com/problems/find-target-indices-after-sorting-array,0.0533,1,0.432
2089,Find Target Indices After Sorting Array,Facebook,2.0,Easy,"Array, Binary Search, Sorting",77.42,False,Algorithms,1915,104,https://leetcode.com/problems/find-target-indices-after-sorting-array,0.0036,1,0.4022
2085,Count Common Words With One Occurrence,Jane Street,1.0,Easy,"Array, Hash Table, String, Counting",72.63,False,Algorithms,888,20,https://leetcode.com/problems/count-common-words-with-one-occurrence,0.0,1,0.4
2080,Range Frequency Queries,Quora,1.0,Medium,"Array, Hash Table, Binary Search, Design, Segment Tree",40.26,False,Algorithms,714,28,https://leetcode.com/problems/range-frequency-queries,0.0,2,0.2
2079,Watering Plants,Google,1.0,Medium,"Array, Simulation",80.01,False,Algorithms,953,72,https://leetcode.com/problems/watering-plants,0.0133,2,0.208
2078,Two Furthest Houses With Different Colors,Amazon,2.0,Easy,"Array, Greedy",65.59,False,Algorithms,987,32,https://leetcode.com/problems/two-furthest-houses-with-different-colors,0.0086,1,0.4052
2076,Process Restricted Friend Requests,Facebook,5.0,Hard,"Union Find, Graph",57.39,False,Algorithms,646,16,https://leetcode.com/problems/process-restricted-friend-requests,0.0142,3,0.1419
2075,Decode the Slanted Ciphertext,Amazon,1.0,Medium,"String, Simulation",49.24,False,Algorithms,258,68,https://leetcode.com/problems/decode-the-slanted-ciphertext,0.0,2,0.2
2074,Reverse Nodes in Even Length Groups,Zopsmart,1.0,Medium,Linked List,61.76,False,Algorithms,819,362,https://leetcode.com/problems/reverse-nodes-in-even-length-groups,0.0,2,0.2
2073,Time Needed to Buy Tickets,Twitter,2.0,Easy,"Array, Queue, Simulation",71.01,False,Algorithms,1786,160,https://leetcode.com/problems/time-needed-to-buy-tickets,0.087,1,0.4522
2070,Most Beautiful Item for Each Query,Postmates,0.0,Medium,"Array, Binary Search, Sorting",62.07,False,Algorithms,1249,45,https://leetcode.com/problems/most-beautiful-item-for-each-query,0.0,2,0.2
2068,Check Whether Two Strings are Almost Equivalent,Salesforce,1.0,Easy,"Hash Table, String, Counting",63.79,False,Algorithms,562,22,https://leetcode.com/problems/check-whether-two-strings-are-almost-equivalent,0.0,1,0.4
2062,Count Vowel Substrings of a String,Commvault,1.0,Easy,"Hash Table, String",71.86,False,Algorithms,1077,382,https://leetcode.com/problems/count-vowel-substrings-of-a-string,0.0,1,0.4
2058,Find the Minimum and Maximum Number of Nodes Between Critical Points,Info Edge,1.0,Medium,Linked List,69.44,False,Algorithms,1344,71,https://leetcode.com/problems/find-the-minimum-and-maximum-number-of-nodes-between-critical-points,0.0,2,0.2
2057,Smallest Index With Equal Value,Google,1.0,Easy,Array,72.66,False,Algorithms,448,144,https://leetcode.com/problems/smallest-index-with-equal-value,0.0133,1,0.408
2055,Plates Between Candles,Amazon,3.0,Medium,"Array, String, Binary Search, Prefix Sum",46.85,False,Algorithms,1320,70,https://leetcode.com/problems/plates-between-candles,0.0172,2,0.2103
2055,Plates Between Candles,Tiktok,3.0,Medium,"Array, String, Binary Search, Prefix Sum",46.85,False,Algorithms,1320,70,https://leetcode.com/problems/plates-between-candles,0.1667,2,0.3
2054,Two Best Non-Overlapping Events,Razorpay,1.0,Medium,"Array, Binary Search, Dynamic Programming, Sorting, Heap (Priority Queue)",60.83,False,Algorithms,1533,58,https://leetcode.com/problems/two-best-non-overlapping-events,0.0,2,0.2
2053,Kth Distinct String in an Array,Amazon,1.0,Easy,"Array, Hash Table, String, Counting",82.04,False,Algorithms,1288,50,https://leetcode.com/problems/kth-distinct-string-in-an-array,0.0,1,0.4
2050,Parallel Courses III,Pinterest,4.0,Hard,"Array, Dynamic Programming, Graph, Topological Sort",66.79,False,Algorithms,1658,46,https://leetcode.com/problems/parallel-courses-iii,1.0,3,0.7333
2048,Next Greater Numerically Balanced Number,Sprinklr,1.0,Medium,"Hash Table, Math, Backtracking, Counting, Enumeration",49.26,False,Algorithms,205,286,https://leetcode.com/problems/next-greater-numerically-balanced-number,0.0,2,0.2
2047,Number of Valid Words in a Sentence,Amazon,2.0,Easy,String,30.17,False,Algorithms,337,819,https://leetcode.com/problems/number-of-valid-words-in-a-sentence,0.0086,1,0.4052
2043,Simple Bank System,Phonepe,1.0,Medium,"Array, Hash Table, Design, Simulation",61.24,False,Algorithms,314,243,https://leetcode.com/problems/simple-bank-system,0.0,2,0.2
2042,Check if Numbers Are Ascending in a Sentence,Apple,2.0,Easy,String,72.1,False,Algorithms,667,22,https://leetcode.com/problems/check-if-numbers-are-ascending-in-a-sentence,0.0256,1,0.4154
2039,The Time When the Network Becomes Idle,Deutsche Bank,1.0,Medium,"Array, Breadth-First Search, Graph",54.22,False,Algorithms,730,74,https://leetcode.com/problems/the-time-when-the-network-becomes-idle,0.0,2,0.2
2038,Remove Colored Pieces if Both Neighbors are the Same Color,Walmart Global Tech,9.0,Medium,"Math, String, Greedy, Game Theory",62.9,False,Algorithms,1620,127,https://leetcode.com/problems/remove-colored-pieces-if-both-neighbors-are-the-same-color,1.0,2,0.8
2034,Stock Price Fluctuation ,Google,30.0,Medium,"Hash Table, Design, Heap (Priority Queue), Data Stream, Ordered Set",48.34,False,Algorithms,1248,69,https://leetcode.com/problems/stock-price-fluctuation,0.4,2,0.44
2033,Minimum Operations to Make a Uni-Value Grid,Facebook,3.0,Medium,"Array, Math, Sorting, Matrix",67.5,False,Algorithms,1093,75,https://leetcode.com/problems/minimum-operations-to-make-a-uni-value-grid,0.0071,2,0.2043
2032,Two Out of Three,Booking.Com,1.0,Easy,"Array, Hash Table, Bit Manipulation",76.77,False,Algorithms,800,52,https://leetcode.com/problems/two-out-of-three,0.0,1,0.4
2028,Find Missing Observations,Microsoft,0.0,Medium,"Array, Math, Simulation",57.39,False,Algorithms,1117,107,https://leetcode.com/problems/find-missing-observations,0.0,2,0.2
2027,Minimum Moves to Convert String,Jeavio,1.0,Easy,"String, Greedy",56.82,False,Algorithms,510,79,https://leetcode.com/problems/minimum-moves-to-convert-string,0.0,1,0.4
2024,Maximize the Confusion of an Exam,Amazon,2.0,Medium,"String, Binary Search, Sliding Window, Prefix Sum",68.94,False,Algorithms,3020,50,https://leetcode.com/problems/maximize-the-confusion-of-an-exam,0.0086,2,0.2052
2023,Number of Pairs of Strings With Concatenation Equal to Target,Facebook,2.0,Medium,"Array, Hash Table, String, Counting",74.96,False,Algorithms,739,56,https://leetcode.com/problems/number-of-pairs-of-strings-with-concatenation-equal-to-target,0.0036,2,0.2022
2022,Convert 1D Array Into 2D Array,Google,1.0,Easy,"Array, Matrix, Simulation",71.89,False,Algorithms,1270,103,https://leetcode.com/problems/convert-1d-array-into-2d-array,0.0133,1,0.408
2018,Check if Word Can Be Placed In Crossword,Google,4.0,Medium,"Array, Matrix, Enumeration",50.17,False,Algorithms,319,310,https://leetcode.com/problems/check-if-word-can-be-placed-in-crossword,0.0533,2,0.232
2017,Grid Game,T System,1.0,Medium,"Array, Matrix, Prefix Sum",60.95,False,Algorithms,1790,92,https://leetcode.com/problems/grid-game,0.0,2,0.2
2016,Maximum Difference Between Increasing Elements,Cisco,6.0,Easy,Array,66.27,False,Algorithms,1470,44,https://leetcode.com/problems/maximum-difference-between-increasing-elements,0.3333,1,0.6
2016,Maximum Difference Between Increasing Elements,Expedia,3.0,Easy,Array,66.27,False,Algorithms,1470,44,https://leetcode.com/problems/maximum-difference-between-increasing-elements,0.1538,1,0.4923
2012,Sum of Beauty in the Array,Amazon,1.0,Medium,Array,50.37,False,Algorithms,670,74,https://leetcode.com/problems/sum-of-beauty-in-the-array,0.0,2,0.2
2007,Find Original Array From Doubled Array,Google,14.0,Medium,"Array, Hash Table, Greedy, Sorting",40.55,False,Algorithms,2531,117,https://leetcode.com/problems/find-original-array-from-doubled-array,0.1867,2,0.312
2007,Find Original Array From Doubled Array,Microsoft,2.0,Medium,"Array, Hash Table, Greedy, Sorting",40.55,False,Algorithms,2531,117,https://leetcode.com/problems/find-original-array-from-doubled-array,0.0385,2,0.2231
2006,Count Number of Pairs With Absolute Difference K,Amazon,1.0,Easy,"Array, Hash Table, Counting",85.02,False,Algorithms,1755,47,https://leetcode.com/problems/count-number-of-pairs-with-absolute-difference-k,0.0,1,0.4
2000,Reverse Prefix of Word,Optum,1.0,Easy,"Two Pointers, String, Stack",86.44,False,Algorithms,1451,44,https://leetcode.com/problems/reverse-prefix-of-word,0.0,1,0.4
1996,The Number of Weak Characters in the Game,Bytedance,4.0,Medium,"Array, Stack, Greedy, Sorting, Monotonic Stack",44.27,False,Algorithms,3070,99,https://leetcode.com/problems/the-number-of-weak-characters-in-the-game,0.3333,2,0.4
1996,The Number of Weak Characters in the Game,Google,3.0,Medium,"Array, Stack, Greedy, Sorting, Monotonic Stack",44.27,False,Algorithms,3070,99,https://leetcode.com/problems/the-number-of-weak-characters-in-the-game,0.04,2,0.224
1996,The Number of Weak Characters in the Game,Tiktok,3.0,Medium,"Array, Stack, Greedy, Sorting, Monotonic Stack",44.27,False,Algorithms,3070,99,https://leetcode.com/problems/the-number-of-weak-characters-in-the-game,0.1667,2,0.3
1992,Find All Groups of Farmland,Citrix,1.0,Medium,"Array, Depth-First Search, Breadth-First Search, Matrix",75.49,False,Algorithms,1421,91,https://leetcode.com/problems/find-all-groups-of-farmland,0.0,2,0.2
1991,Find the Middle Index in Array,Facebook,3.0,Easy,"Array, Prefix Sum",68.37,False,Algorithms,1484,76,https://leetcode.com/problems/find-the-middle-index-in-array,0.0071,1,0.4043
1985,Find the Kth Largest Integer in the Array,Facebook,4.0,Medium,"Array, String, Divide and Conquer, Sorting, Heap (Priority Queue), Quickselect",47.01,False,Algorithms,1332,158,https://leetcode.com/problems/find-the-kth-largest-integer-in-the-array,0.0107,2,0.2064
1981,Minimize the Difference Between Target and Chosen Elements,Amazon,1.0,Medium,"Array, Dynamic Programming, Matrix",36.03,False,Algorithms,1035,145,https://leetcode.com/problems/minimize-the-difference-between-target-and-chosen-elements,0.0,2,0.2
1980,Find Unique Binary String,Amazon,2.0,Medium,"Array, Hash Table, String, Backtracking",79.39,False,Algorithms,2536,89,https://leetcode.com/problems/find-unique-binary-string,0.0086,2,0.2052
1979,Find Greatest Common Divisor of Array,Tiaa,1.0,Easy,"Array, Math, Number Theory",78.84,False,Algorithms,1227,52,https://leetcode.com/problems/find-greatest-common-divisor-of-array,0.0,1,0.4
1974,Minimum Time to Type Word Using Special Typewriter,Tiktok,3.0,Easy,"String, Greedy",77.94,False,Algorithms,758,37,https://leetcode.com/problems/minimum-time-to-type-word-using-special-typewriter,0.1667,1,0.5
1971,Find if Path Exists in Graph,Amazon,4.0,Easy,"Depth-First Search, Breadth-First Search, Union Find, Graph",54.2,False,Algorithms,4154,243,https://leetcode.com/problems/find-if-path-exists-in-graph,0.0259,1,0.4155
1971,Find if Path Exists in Graph,Google,3.0,Easy,"Depth-First Search, Breadth-First Search, Union Find, Graph",54.2,False,Algorithms,4154,243,https://leetcode.com/problems/find-if-path-exists-in-graph,0.04,1,0.424
1968,Array With Elements Not Equal to Average of Neighbors,Amazon,2.0,Medium,"Array, Greedy, Sorting",50.23,False,Algorithms,651,56,https://leetcode.com/problems/array-with-elements-not-equal-to-average-of-neighbors,0.0086,2,0.2052
1967,Number of Strings That Appear as Substrings in Word,Uber,1.0,Easy,"Array, String",82.07,False,Algorithms,742,42,https://leetcode.com/problems/number-of-strings-that-appear-as-substrings-in-word,0.0,1,0.4
1966,Binary Searchable Numbers in an Unsorted Array,Google,1.0,Medium,"Array, Binary Search",62.56,True,Algorithms,76,12,https://leetcode.com/problems/binary-searchable-numbers-in-an-unsorted-array,0.0133,2,0.208
1961,Check If String Is a Prefix of Array,Uber,1.0,Easy,"Array, Two Pointers, String",52.59,False,Algorithms,533,109,https://leetcode.com/problems/check-if-string-is-a-prefix-of-array,0.0,1,0.4
1957,Delete Characters to Make Fancy String,Wayfair,1.0,Easy,String,74.27,False,Algorithms,1159,53,https://leetcode.com/problems/delete-characters-to-make-fancy-string,0.0,1,0.4
1952,Three Divisors,Microsoft,1.0,Easy,"Math, Enumeration, Number Theory",63.1,False,Algorithms,596,34,https://leetcode.com/problems/three-divisors,0.0192,1,0.4115
1945,Sum of Digits of String After Convert,Microsoft,1.0,Easy,"String, Simulation",74.75,False,Algorithms,1177,103,https://leetcode.com/problems/sum-of-digits-of-string-after-convert,0.0192,1,0.4115
1941,Check if All Characters Have Equal Number of Occurrences,Bolt,5.0,Easy,"Hash Table, String, Counting",78.84,False,Algorithms,1009,28,https://leetcode.com/problems/check-if-all-characters-have-equal-number-of-occurrences,1.0,1,1.0
1935,Maximum Number of Words You Can Type,Quora,1.0,Easy,"Hash Table, String",74.85,False,Algorithms,623,31,https://leetcode.com/problems/maximum-number-of-words-you-can-type,0.0,1,0.4
1929,Concatenation of Array,Google,4.0,Easy,"Array, Simulation",90.53,False,Algorithms,3626,426,https://leetcode.com/problems/concatenation-of-array,0.0533,1,0.432
1929,Concatenation of Array,Adobe,2.0,Easy,"Array, Simulation",90.53,False,Algorithms,3626,426,https://leetcode.com/problems/concatenation-of-array,0.0196,1,0.4118
1926,Nearest Exit from Entrance in Maze,Amazon,2.0,Medium,"Array, Breadth-First Search, Matrix",47.77,False,Algorithms,2530,121,https://leetcode.com/problems/nearest-exit-from-entrance-in-maze,0.0086,2,0.2052
1925,Count Square Sum Triples,Amazon,2.0,Easy,"Math, Enumeration",69.25,False,Algorithms,447,44,https://leetcode.com/problems/count-square-sum-triples,0.0086,1,0.4052
1920,Build Array from Permutation,Apple,5.0,Easy,"Array, Simulation",91.08,False,Algorithms,3898,470,https://leetcode.com/problems/build-array-from-permutation,0.1026,1,0.4616
1920,Build Array from Permutation,Adobe,3.0,Easy,"Array, Simulation",91.08,False,Algorithms,3898,470,https://leetcode.com/problems/build-array-from-permutation,0.0392,1,0.4235
1920,Build Array from Permutation,Uber,2.0,Easy,"Array, Simulation",91.08,False,Algorithms,3898,470,https://leetcode.com/problems/build-array-from-permutation,0.0286,1,0.4172
1920,Build Array from Permutation,Google,2.0,Easy,"Array, Simulation",91.08,False,Algorithms,3898,470,https://leetcode.com/problems/build-array-from-permutation,0.0267,1,0.416
1910,Remove All Occurrences of a Substring,Microsoft,3.0,Medium,"String, Stack, Simulation",78.2,False,Algorithms,2528,88,https://leetcode.com/problems/remove-all-occurrences-of-a-substring,0.0577,2,0.2346
1910,Remove All Occurrences of a Substring,Makemytrip,2.0,Medium,"String, Stack, Simulation",78.2,False,Algorithms,2528,88,https://leetcode.com/problems/remove-all-occurrences-of-a-substring,0.0,2,0.2
1910,Remove All Occurrences of a Substring,Google,2.0,Medium,"String, Stack, Simulation",78.2,False,Algorithms,2528,88,https://leetcode.com/problems/remove-all-occurrences-of-a-substring,0.0267,2,0.216
1910,Remove All Occurrences of a Substring,Amazon,2.0,Medium,"String, Stack, Simulation",78.2,False,Algorithms,2528,88,https://leetcode.com/problems/remove-all-occurrences-of-a-substring,0.0086,2,0.2052
1909,Remove One Element to Make the Array Strictly Increasing,Facebook,2.0,Easy,Array,28.92,False,Algorithms,1297,347,https://leetcode.com/problems/remove-one-element-to-make-the-array-strictly-increasing,0.0036,1,0.4022
1904,The Number of Full Rounds You Have Played,Wayfair,4.0,Medium,"Math, String",43.34,False,Algorithms,224,263,https://leetcode.com/problems/the-number-of-full-rounds-you-have-played,0.1579,2,0.2947
1897,Redistribute Characters to Make All Strings Equal,Moengage,1.0,Easy,"Hash Table, String, Counting",66.78,False,Algorithms,1149,82,https://leetcode.com/problems/redistribute-characters-to-make-all-strings-equal,0.0,1,0.4
1893,Check if All the Integers in a Range Are Covered,Bloomberg,1.0,Easy,"Array, Hash Table, Prefix Sum",50.51,False,Algorithms,656,123,https://leetcode.com/problems/check-if-all-the-integers-in-a-range-are-covered,0.0,1,0.4
